asin,product_title,product_price,product_original_price,currency,product_star_rating,product_num_ratings,product_url,product_photo,product_num_offers,product_minimum_offer_price,is_best_seller,is_amazon_choice,is_prime,climate_pledge_friendly,sales_volume,delivery,has_variations
B0CMDPRN7M,"SAMSUNG Galaxy S24 Cell Phone, 128GB AI Smartphone, Unlocked Android, 50MP Camera, Fastest Processor, Long Battery Life, US Version, 2024, Cobalt Violet",$799.99,,USD,4.4,22,https://www.amazon.com/dp/B0CMDPRN7M,https://m.media-amazon.com/images/I/716UvwH-NvL._AC_UY654_FMwebp_QL65_.jpg,2,$518.23,False,False,True,True,500+ bought in past month,"FREE delivery Sun, Aug 4 Or fastest delivery Thu, Aug 1",False
B0CWHXVLXG,Moto G 5G | 2024 | Unlocked | Made for US 4/128GB | 50MP Camera | Sage Green,$179.99,$199.99,USD,4.2,2231,https://www.amazon.com/dp/B0CWHXVLXG,https://m.media-amazon.com/images/I/71Sbx9zQN3L._AC_UY654_FMwebp_QL65_.jpg,1,$179.99,False,False,True,False,1K+ bought in past month,"FREE delivery Sun, Aug 4 Or fastest delivery Thu, Aug 1",False
B0BQ118F2T,Moto G Play 2023 3-Day Battery Unlocked Made for US 3/32GB 16MP Camera Navy Blue,$99.99,$169.99,USD,4,2908,https://www.amazon.com/dp/B0BQ118F2T,https://m.media-amazon.com/images/I/61K1Fz5LxvL._AC_UY654_FMwebp_QL65_.jpg,1,$99.99,False,False,True,False,5K+ bought in past month,"FREE delivery Sun, Aug 4 Or fastest delivery Thu, Aug 1",False
B0CD2YV1WZ,Motorola Edge | 2022 | 2-Day Battery | Unlocked | Made for US 6/128GB | 50MP Camera | Mineral Gray,$169.99,,USD,4.2,1631,https://www.amazon.com/dp/B0CD2YV1WZ,https://m.media-amazon.com/images/I/518sngb0tKL._AC_UY654_FMwebp_QL65_.jpg,9,$133.34,False,False,True,False,400+ bought in past month,"FREE delivery Sun, Aug 4 Or fastest delivery Thu, Aug 1",True
B09D2ZJLLV,Panasonic KX-TG994 DECT 6.0 Bluetooth 4-Handset Phone Bundle,$89.97,,USD,4.3,290,https://www.amazon.com/dp/B09D2ZJLLV,https://m.media-amazon.com/images/I/81AxAgS8C+L._AC_UY654_FMwebp_QL65_.jpg,16,$59.99,False,False,True,False,1K+ bought in past month,"FREE delivery Sun, Aug 4 Or fastest delivery Fri, Aug 2",False
B0CV1FCLLR,"Motorola Moto G14 Dual SIM (2023) 4G LTE (4/128GB) 6.5&quot;&quot; IPS LDC Display | Android 13 | 50MP Rear Camera | 5000mAh Battery | International Model - (Steel Gray), XT2341-2",$115.13,$149.99,USD,4.4,10,https://www.amazon.com/dp/B0CV1FCLLR,https://m.media-amazon.com/images/I/61TtGkw5IFL._AC_UY654_FMwebp_QL65_.jpg,6,$95.99,False,False,True,False,100+ bought in past month,"FREE delivery Sun, Aug 4 Or fastest delivery Thu, Aug 1",True
B0CPF7FFT2,"8849 Tank 3 Rugged Smartphone, 23800mAh 5G Outdoor Rugged Cell Phone Unlocked, 32GB RAM+512GB ROM, 6.79&quot; Waterproof Android 13 Mobile Phones, 200MP Main Camera/OTG/NFC(Support T-Mobile &amp; Verizon Only)",$549.99,$659.99,USD,3.6,53,https://www.amazon.com/dp/B0CPF7FFT2,https://m.media-amazon.com/images/I/714oCZTUjIL._AC_UY654_FMwebp_QL65_.jpg,1,$549.99,False,False,True,False,50+ bought in past month,"FREE delivery Sun, Aug 4 Or fastest delivery Thu, Aug 1",False
B0CMDL3H3P,"SAMSUNG Galaxy S24 Ultra Cell Phone, 256GB AI Smartphone, Unlocked Android, 50MP Zoom Camera, Long Battery Life, S Pen, US Version, 2024, Titanium Gray","$1,299.99",,USD,4.5,104,https://www.amazon.com/dp/B0CMDL3H3P,https://m.media-amazon.com/images/I/71-EnPs+uQL._AC_UY654_FMwebp_QL65_.jpg,3,$930.00,False,False,True,True,1K+ bought in past month,"FREE delivery Sun, Aug 4 Or fastest delivery Thu, Aug 1",False
B00BLVLHO0,"VTech CS6629-3 DECT 6.0 Expandable Cordless Phone with Answering System and Caller ID/Call Waiting, Silver with 3 Handsets, 6.9&quot; x 6.7&quot; x 5.2&quot;",$60.81,$75.99,USD,4.2,421,https://www.amazon.com/dp/B00BLVLHO0,https://m.media-amazon.com/images/I/81GvK0+yb-L._AC_UY654_FMwebp_QL65_.jpg,1,$60.81,False,False,False,False,100+ bought in past month,FREE delivery Aug 1 - 2,False
B0CFB7W1W2,"Total by Verizon Motorola moto g Play, 32GB, Black - Prepaid Smartphone (Locked)",$54.18,,USD,3.8,91,https://www.amazon.com/dp/B0CFB7W1W2,https://m.media-amazon.com/images/I/71pGGUaxezL._AC_UY654_FMwebp_QL65_.jpg,13,$45.00,False,False,True,False,More Buying Choices,"FREE delivery Sun, Aug 4 Or fastest delivery Thu, Aug 1",False
B0CH7Q92J8,"NUU A23Plus Basic Cell Phone for AT&amp;T, T-Mobile, Cricket, Mint Mobile, Metro, 64G/3GB 6.3&quot; 4G LTE, Q Link, Hello Mobile Dual SIM, Black, 365 Days US Warranty with Detachable &amp; Replaceable Battery",$87.99,,USD,3.6,361,https://www.amazon.com/dp/B0CH7Q92J8,https://m.media-amazon.com/images/I/71P-Cch1wlL._AC_UY654_FMwebp_QL65_.jpg,2,$85.01,False,False,True,False,300+ bought in past month,"FREE delivery Sun, Aug 4 Or fastest delivery Thu, Aug 1",False
B09Z8P34NM,"SAMSUNG Galaxy A13 LTE, Factory Unlocked Smartphone, Android Cell Phone, Water Resistant, 50MP Camera, US Version, 32GB, Black (Renewed)",$91.00,,USD,4,479,https://www.amazon.com/dp/B09Z8P34NM,https://m.media-amazon.com/images/I/61IX+1qw35L._AC_UY654_FMwebp_QL65_.jpg,24,$74.00,False,False,False,False,1K+ bought in past month,"FREE delivery Thu, Aug 1 Only 20 left in stock - order soon.",False
B01KLNIT0S,Panasonic Expandable Cordless Phone System with Amber Backlit Display – 2 Handsets – KX-TGC352B (Black),$49.99,,USD,4.4,12048,https://www.amazon.com/dp/B01KLNIT0S,https://m.media-amazon.com/images/I/81PAlx8pPAL._AC_UY654_FMwebp_QL65_.jpg,7,$20.39,False,False,True,False,3K+ bought in past month,"FREE delivery Sun, Aug 4 Or fastest delivery Thu, Aug 1",False
B07JMHLP7B,Panasonic DECT 6.0 Expandable Cordless Phone System with Answering Machine and Call Blocking - 3 Handsets - KX-TGE633M (Metallic Black),$89.99,$99.99,USD,4.3,2035,https://www.amazon.com/dp/B07JMHLP7B,https://m.media-amazon.com/images/I/81d5dbKZi6L._AC_UY654_FMwebp_QL65_.jpg,6,$49.52,False,False,True,False,800+ bought in past month,"FREE delivery Sun, Aug 4 Or fastest delivery Thu, Aug 1",False
B01JFDMEDI,"VTech DECT 6.0 Expandable Cordless Phone with Answering System and Caller ID, Silver/Black CS6929",$34.97,$39.97,USD,4.2,69,https://www.amazon.com/dp/B01JFDMEDI,https://m.media-amazon.com/images/I/618My558ocL._AC_UY654_FMwebp_QL65_.jpg,3,$22.59,False,False,True,False,100+ bought in past month,"FREE delivery Sun, Aug 4 on $35 of items shipped by AmazonOr fastest delivery Thu, Aug 1",False
B0BHHJV7W9,"AT&amp;T CL82507 DECT 6.0 5-Handset Cordless Phone for Home with Answering Machine, Call Blocking, Caller ID Announcer, Intercom and Long Range, Silver",$105.99,$131.95,USD,4.3,20466,https://www.amazon.com/dp/B0BHHJV7W9,https://m.media-amazon.com/images/I/81hx19bxj2L._AC_UY654_FMwebp_QL65_.jpg,2,$68.45,False,False,True,False,500+ bought in past month,"FREE delivery Sun, Aug 4 Or fastest delivery Thu, Aug 1",False
B0CJR6LF6Q,"VTech LS6381 DECT 6.0 Cordless Phone with Bluetooth Speaker, Echo Cancellation, Noise Reduction, Music Streaming, Landline Phone with Answering Machine Easy to Read Smart Call Blocker",$52.95,$57.95,USD,4,1871,https://www.amazon.com/dp/B0CJR6LF6Q,https://m.media-amazon.com/images/I/71m4wGZmBgL._AC_UY654_FMwebp_QL65_.jpg,3,$29.29,False,False,True,False,200+ bought in past month,"FREE delivery Sun, Aug 4 Or fastest delivery Thu, Aug 1",False
B007B5VH0E,"AT&amp;T CL4940 Corded Standard Phone with Answering System and Backlit Display, White",$39.95,$43.95,USD,4.4,13385,https://www.amazon.com/dp/B007B5VH0E,https://m.media-amazon.com/images/I/71d7a++X2UL._AC_UY654_FMwebp_QL65_.jpg,76,$16.33,False,False,True,False,1K+ bought in past month,"FREE delivery Sun, Aug 4 Or fastest delivery Thu, Aug 1",False
B09MHFBMZ1,"VTech IS8251-3 Business Grade 3-Handset Expandable Cordless Phone for Home Office, 5&quot; Color Display,Programmable Short Cut Keys, Smart Call Blocking,Answering System,Bluetooth Connect to Cell,IS8251-3",$133.33,$149.95,USD,4.2,884,https://www.amazon.com/dp/B09MHFBMZ1,https://m.media-amazon.com/images/I/81faS7PfQML._AC_UY654_FMwebp_QL65_.jpg,2,$55.45,False,False,True,False,300+ bought in past month,"FREE delivery Sun, Aug 4 Or fastest delivery Thu, Aug 1",False
B00N22M0XS,"AT&amp;T EL51203 2 Handset DECT 6.0 Cordless Home Phone Full-Duplex Handset Speakerphone, Backlit Display, Lighted Keypad, Caller ID/Call Waiting, Phonebook, Eco Mode, Voicemail Key, Quiet Mode,Intercom",$37.37,$43.95,USD,4.3,17437,https://www.amazon.com/dp/B00N22M0XS,https://m.media-amazon.com/images/I/71yY8CDrnxL._AC_UY654_FMwebp_QL65_.jpg,4,$17.31,False,False,True,False,1K+ bought in past month,"FREE delivery Sun, Aug 4 Or fastest delivery Thu, Aug 1",False
B0CF2PV74C,Motorola Moto G54 Dual-SIM 256GB ROM + 8GB RAM (Only GSM | No CDMA) Factory Unlocked 5G Smartphone (Midnight Blue) - International Version,$178.78,$187.50,USD,4.4,879,https://www.amazon.com/dp/B0CF2PV74C,https://m.media-amazon.com/images/I/71hK54VMakL._AC_UY654_FMwebp_QL65_.jpg,5,$177.67,False,False,True,False,200+ bought in past month,"FREE delivery Sun, Aug 4 Or fastest delivery Thu, Aug 1",False
B0CCT2VXHC,"TracFone Nokia 2760 Flip, 4GB, Black - Prepaid Feature Phone (Locked) (Renewed)",$14.99,,USD,3.5,31,https://www.amazon.com/dp/B0CCT2VXHC,https://m.media-amazon.com/images/I/615vgooiuhL._AC_UY654_FMwebp_QL65_.jpg,1,$14.99,False,False,True,True,400+ bought in past month,"FREE delivery Sun, Aug 4 on $35 of items shipped by AmazonOr fastest delivery Thu, Aug 1",False
B0B8W377RV,"Google Pixel 6a 5G, US Version, 128GB, Charcoal - Unlocked (Renewed)",$160.79,$349.99,USD,3.9,902,https://www.amazon.com/dp/B0B8W377RV,https://m.media-amazon.com/images/I/51+p2QXs81L._AC_UY654_FMwebp_QL65_.jpg,28,$149.94,False,False,False,False,500+ bought in past month,"FREE delivery Aug 6 - 8 Or fastest delivery Thu, Aug 1 Only 1 left in stock - order soon.",True
B0BTFHM2GZ,"Panasonic Cordless Phone with Advanced Call Block, Link2Cell Bluetooth, One-Ring Scam Alert, and 2-Way Recording with Answering Machine, 5 Handsets - KX-TGF975B (Black with Silver Trim)",$159.99,$179.99,USD,4.3,1164,https://www.amazon.com/dp/B0BTFHM2GZ,https://m.media-amazon.com/images/I/71GFOQskU-L._AC_UY654_FMwebp_QL65_.jpg,2,$82.46,False,False,True,False,List: ,"FREE delivery Sun, Aug 4 Or fastest delivery Thu, Aug 1",False
B07X4B9G32,Moto Z4 - For Verizon - 128 GB - Flash Gray (Renewed),$83.47,$112.00,USD,4.2,784,https://www.amazon.com/dp/B07X4B9G32,https://m.media-amazon.com/images/I/61Ms2sYQ0CL._AC_UY654_FMwebp_QL65_.jpg,10,$72.78,False,False,False,True,100+ bought in past month,"FREE delivery Wed, Aug 7 Or fastest delivery Tomorrow, Jul 31 Only 5 left in stock - order soon.",False
B07SC58QBW,"Apple iPhone XS, US Version, 64GB, Space Gray - Unlocked (Renewed)",$179.99,,USD,4.2,21717,https://www.amazon.com/dp/B07SC58QBW,https://m.media-amazon.com/images/I/51I7GPdU6LL._AC_UY654_FMwebp_QL65_.jpg,4,$178.00,False,False,False,True,500+ bought in past month,"FREE delivery Thu, Aug 1 Only 2 left in stock - order soon.",True
B0D3XTS4WD,"VTech CS6529-5 5-Handset DECT 6.0 Cordless Phone with Answering System, Caller ID/Call Waiting, Wall-Mountable, LCD Screen, Handset Speakerphone (Silver/Black)",$69.50,$77.22,USD,4.3,25927,https://www.amazon.com/dp/B0D3XTS4WD,https://m.media-amazon.com/images/I/81Qh64eRzcL._AC_UY654_FMwebp_QL65_.jpg,2,$66.03,False,False,True,False,200+ bought in past month,"FREE delivery Sun, Aug 4 Or fastest delivery Thu, Aug 1",False
B07H13CDFK,"AT&amp;T CL82257 DECT 6.0 2-Handset Cordless Phone for Home with Answering Machine, Call Blocking, Caller ID Announcer, Intercom and Long Range, Rose Gold",$58.18,$65.95,USD,4.3,7512,https://www.amazon.com/dp/B07H13CDFK,https://m.media-amazon.com/images/I/814hez1kiNL._AC_UY654_FMwebp_QL65_.jpg,3,$46.96,False,False,True,False,200+ bought in past month,"FREE delivery Sun, Aug 4 Or fastest delivery Thu, Aug 1",False
B0D1DN7HMG,Nokia 105 4G | Dual SIM | GSM Unlocked Mobile Phone | Volte | Charcoal | International Version | Not AT&amp;T/Cricket/Verizon Compatible,$34.58,,USD,3.3,14,https://www.amazon.com/dp/B0D1DN7HMG,https://m.media-amazon.com/images/I/41X3VbihvpL._AC_UY654_FMwebp_QL65_.jpg,2,$26.94,False,False,True,False,500+ bought in past month,"FREE delivery Sun, Aug 4 on $35 of items shipped by AmazonOr fastest delivery Thu, Aug 1",False
B0CPHVLVVQ,"A09 Unlocked Android Phones, Android 12 Smartphones, 6.56&quot; HD+, 4000mAh 10W Fast, Octa-Core 8GB+128GB/SD 256GB Smart Phone, 13MP+8MP, Face ID Unlock Phone, 4G Dual SIM Phone - Black",$89.99,,USD,3.9,14,https://www.amazon.com/dp/B0CPHVLVVQ,https://m.media-amazon.com/images/I/61VpSm4vocL._AC_UY654_FMwebp_QL65_.jpg,1,$89.99,False,False,True,False,100+ bought in past month,"FREE delivery Sun, Aug 4 Or fastest delivery Thu, Aug 1",True
B0C6STZMVJ,"Corded Phone for Home, Durable landline Phone with Large Buttons for Seniors, Versatile Mini Phone for The Home, Office, and More(White)",$13.99,,USD,3.6,276,https://www.amazon.com/dp/B0C6STZMVJ,https://m.media-amazon.com/images/I/61a2DloT+-L._AC_UY654_FMwebp_QL65_.jpg,1,$13.99,False,False,True,False,300+ bought in past month,"FREE delivery Sun, Aug 4 on $35 of items shipped by AmazonOr fastest delivery Thu, Aug 1",False
B0BZG31S2R,"Panasonic Cordless Phone with Answering Machine, Link2Cell Bluetooth, Voice Assistant and Advanced Call Blocking, Expandable System with 4 Handsets - KX-TGD864W (White)",$99.93,$119.99,USD,4.4,1193,https://www.amazon.com/dp/B0BZG31S2R,https://m.media-amazon.com/images/I/71EwYZ1t6BL._AC_UY654_FMwebp_QL65_.jpg,9,$56.10,False,False,True,False,1K+ bought in past month,"FREE delivery Tue, Aug 6 Or fastest delivery Thu, Aug 1",False
B09X7F2GCG,"TracFone TCL Flip 2, 8GB, Black - Prepaid Flip Phone (Locked)",$19.99,,USD,4,784,https://www.amazon.com/dp/B09X7F2GCG,https://m.media-amazon.com/images/I/71S0voBvL8L._AC_UY654_FMwebp_QL65_.jpg,1,$19.99,False,False,True,False,500+ bought in past month,"FREE delivery Sun, Aug 4 on $35 of items shipped by AmazonOr fastest delivery Fri, Aug 2",False
B09LKXHWCF,"Apple iPhone 13 Mini, 128GB, Blue - Unlocked (Renewed)",$349.95,$415.00,USD,4.2,3862,https://www.amazon.com/dp/B09LKXHWCF,https://m.media-amazon.com/images/I/71uVYy3PbCL._AC_UY654_FMwebp_QL65_.jpg,13,$295.86,False,False,True,True,1K+ bought in past month,"FREE delivery Thu, Aug 8 Only 1 left in stock - order soon.",True
B0CSDY4NSF,Xiaomi Redmi Note 13 PRO 5G + 4G LTE (256GB + 8GB) 6.67&quot; 200MP Triple (Tmobile Mint Tello &amp; Global) GLOBAL Bands Unlocked + (Fast Car Dual Charger Bundle) (Aurora Purple (Global ROM)),$287.50,,USD,4.7,2491,https://www.amazon.com/dp/B0CSDY4NSF,https://m.media-amazon.com/images/I/61vFWIksgcL._AC_UY654_FMwebp_QL65_.jpg,7,$232.99,False,False,True,False,100+ bought in past month,"FREE delivery Sun, Aug 4 Or fastest delivery Thu, Aug 1 Only 7 left in stock - order soon.",True
B00IXWW4W4,Panasonic DECT 6.0 Expandable Cordless Phone with Answering Machine and Call Block and Caller ID - 2 Cordless Handsets - KX-TGC222S (Silver),$54.99,,USD,4.2,3139,https://www.amazon.com/dp/B00IXWW4W4,https://m.media-amazon.com/images/I/71XN6Olp2tL._AC_UY654_FMwebp_QL65_.jpg,5,$22.15,False,False,True,False,400+ bought in past month,"FREE delivery Sun, Aug 4 Or fastest delivery Thu, Aug 1",False
B09LKXHWCF,"Apple iPhone 13 Mini, 128GB, Blue - Unlocked (Renewed)",$349.95,$415.00,USD,4.2,3862,https://www.amazon.com/dp/B09LKXHWCF,https://m.media-amazon.com/images/I/71uVYy3PbCL._AC_UY654_FMwebp_QL65_.jpg,13,$295.86,False,False,True,True,1K+ bought in past month,"FREE delivery Thu, Aug 8 Only 1 left in stock - order soon.",True
B0CSDY4NSF,Xiaomi Redmi Note 13 PRO 5G + 4G LTE (256GB + 8GB) 6.67&quot; 200MP Triple (Tmobile Mint Tello &amp; Global) GLOBAL Bands Unlocked + (Fast Car Dual Charger Bundle) (Aurora Purple (Global ROM)),$287.50,,USD,4.7,2491,https://www.amazon.com/dp/B0CSDY4NSF,https://m.media-amazon.com/images/I/61vFWIksgcL._AC_UY654_FMwebp_QL65_.jpg,7,$232.99,False,False,True,False,100+ bought in past month,"FREE delivery Sun, Aug 4 Or fastest delivery Thu, Aug 1 Only 7 left in stock - order soon.",True
B0CNPJGCTJ,"HelloBaby DECT 6.0 Cordless Phone Handset for Home with Caller ID/Call Waiting, Call Block, Full-Duplex Handset Speakerphone, Blue Backlit Display &amp; Big Buttons, Reliable 1000 ft Range",$17.99,,USD,4,217,https://www.amazon.com/dp/B0CNPJGCTJ,https://m.media-amazon.com/images/I/61wizHmAXsL._AC_UY654_FMwebp_QL65_.jpg,2,$17.81,False,False,True,False,500+ bought in past month,"FREE delivery Sun, Aug 4 on $35 of items shipped by AmazonOr fastest delivery Thu, Aug 1",False
B09ZLCN9D8,"VTech VS112-17 DECT 6.0 Bluetooth Expandable Cordless Phone for Home with Answering Machine, Call Blocking, Caller ID, Intercom and Connect to Cell (Silver &amp; White)",$34.99,$43.95,USD,4.2,12719,https://www.amazon.com/dp/B09ZLCN9D8,https://m.media-amazon.com/images/I/7144N3m29tL._AC_UY654_FMwebp_QL65_.jpg,2,$19.73,False,False,True,False,100+ bought in past month,"FREE delivery Sun, Aug 4 on $35 of items shipped by AmazonOr fastest delivery Thu, Aug 1",False
B0BZK2FCJ8,"Panasonic Cordless Phone with Advanced Call Block, Bilingual Caller ID and Easy to Read Large High-Contrast Display, Expandable System with 1 Handset - KX-TGD810B (Black)",$29.99,$34.99,USD,4.3,707,https://www.amazon.com/dp/B0BZK2FCJ8,https://m.media-amazon.com/images/I/71qcUNnQYDL._AC_UY654_FMwebp_QL65_.jpg,4,$14.22,False,False,True,False,1K+ bought in past month,"FREE delivery Sun, Aug 4 on $35 of items shipped by AmazonOr fastest delivery Thu, Aug 1",False
B09DDCGFGJ,"Panasonic Cordless Phone System, Expandable Home Phone with Call Blocking, Bilingual Caller ID and High-Contrast Display, 1 Handset - KX-TGD610B (Black)",$34.49,,USD,4.3,5314,https://www.amazon.com/dp/B09DDCGFGJ,https://m.media-amazon.com/images/I/71c8TK1k0OL._AC_UY654_FMwebp_QL65_.jpg,4,$12.56,False,False,True,False,100+ bought in past month,"FREE delivery Sun, Aug 4 on $35 of items shipped by AmazonOr fastest delivery Thu, Aug 1",False
B09B4BB8HP,BLU J9L J0090WW 32GB Dual Sim GSM Unlocked Android Smartphone - Black,$76.99,,USD,4.1,97,https://www.amazon.com/dp/B09B4BB8HP,https://m.media-amazon.com/images/I/71eh-leuCKL._AC_UY654_FMwebp_QL65_.jpg,1,$76.99,False,False,True,False,50+ bought in past month,"FREE delivery Sun, Aug 4 Or fastest delivery Thu, Aug 1 Only 17 left in stock - order soon.",True
B00O5EUBV0,BLU Jenny TV 2.8 T276T Unlocked GSM Dual-SIM Cell Phone w/ 1.3MP Camera - Unlocked Cell Phones - Retail Packaging - Black Blue,$25.99,,USD,3.6,750,https://www.amazon.com/dp/B00O5EUBV0,https://m.media-amazon.com/images/I/816mNMOqfnL._AC_UY654_FMwebp_QL65_.jpg,5,$25.97,False,False,True,False,50+ bought in past month,"FREE delivery Sun, Aug 4 on $35 of items shipped by AmazonOr fastest delivery Thu, Aug 1",True
B0B9RF3V1T,"Ulefone Android 12 Armor 15 Rugged Phone Unlocked, IP68/IP69K, Built-in TWS Earbuds, 11GB+128GB, 4-Day Battery, 16MP+12MP+13MP Camera, Dual Loud Speakers Dual 4G, Octa-core, OTG, GPS, Black",$199.99,,USD,4,73,https://www.amazon.com/dp/B0B9RF3V1T,https://m.media-amazon.com/images/I/71pEXMtrBAL._AC_UY654_FMwebp_QL65_.jpg,1,$199.99,False,False,True,False,,"FREE delivery Sun, Aug 4 Or fastest delivery Thu, Aug 1 Only 16 left in stock - order soon.",True
B092499CS7,"AT&amp;T CL82267 DECT 6.0 2-Handset Cordless Phone for Home with Answering Machine, Call Blocking, Caller ID Announcer, Intercom and Long Range, Black &amp; Wood Grain Finish",$50.45,$65.95,USD,4.3,7512,https://www.amazon.com/dp/B092499CS7,https://m.media-amazon.com/images/I/81lzanxrOVS._AC_UY654_FMwebp_QL65_.jpg,2,$37.58,False,False,True,False,300+ bought in past month,"FREE delivery Sun, Aug 4 Or fastest delivery Thu, Aug 1",False
B0CX57QV91,"OUKITEL WP36 2024 Rugged Smartphone - 10600mAh Rugged Phone 128dB Loud Speaker, 16GB+128GB Dual Sim Phones 6.52&quot; Big Screen, Android 13 Cell Phone, NFC/OTG, T-mobile Compatible Rugged Smart Phone",$199.99,$219.99,USD,4.3,163,https://www.amazon.com/dp/B0CX57QV91,https://m.media-amazon.com/images/I/81fnPSUMu3L._AC_UY654_FMwebp_QL65_.jpg,1,$199.99,False,False,True,False,200+ bought in past month,"FREE delivery Sun, Aug 4 Or fastest delivery Thu, Aug 1",False
B097XTKYST,Smallest Mobile Phone L8Star BM70 Tiny Mini Mobile White Unlocked,$23.99,,USD,3.5,1129,https://www.amazon.com/dp/B097XTKYST,https://m.media-amazon.com/images/I/61InzF7BgGL._AC_UY654_FMwebp_QL65_.jpg,1,$23.99,False,False,True,False,,"FREE delivery Sun, Aug 4 on $35 of items shipped by AmazonOr fastest delivery Thu, Aug 1",False
B0CSGK59ZB,"Panasonic Corded/Cordless Phone with Advanced Call Block, 2-Way Recording and Digital Answering Machine, 2 Handsets Expandable up to 6 Cordless Handsets - KX-TGF852B (Black)",$99.99,,USD,4.4,92,https://www.amazon.com/dp/B0CSGK59ZB,https://m.media-amazon.com/images/I/81ngV9Xg7hL._AC_UY654_FMwebp_QL65_.jpg,3,$85.55,False,False,True,False,400+ bought in past month,"FREE delivery Sun, Aug 4 Or fastest delivery Thu, Aug 1",False
B0CN6Q9D6T,"AGM M9 4G Rugged Basic Cell Phone, Large Button Cell Phones for Seniors, IP68/IP69K Waterproof, 1.8M Drop-Proof, Large Fonts, Fast Dialling, 3 Card Slots, FM Radio, Torch, 1000 mAh, for T-Mobile Only",$49.99,$79.99,USD,3.9,203,https://www.amazon.com/dp/B0CN6Q9D6T,https://m.media-amazon.com/images/I/61dqNLauyUL._AC_UY654_FMwebp_QL65_.jpg,1,$49.99,False,False,True,False,400+ bought in past month,"FREE delivery Sun, Aug 4 Or fastest delivery Thu, Aug 1",False
B086R819LS,"VTech IS8151-5 Super Long Range 5 Handset DECT 6.0 Cordless Phone for Home with Answering Machine, 2300 ft Range, Call Blocking, Bluetooth, Headset Jack, Power Backup, Intercom, Expandable to 12 HS",$149.45,$164.95,USD,4.2,8518,https://www.amazon.com/dp/B086R819LS,https://m.media-amazon.com/images/I/817N3Lf0hEL._AC_UY654_FMwebp_QL65_.jpg,4,$53.40,False,False,True,False,400+ bought in past month,"FREE delivery Sun, Aug 4 Or fastest delivery Thu, Aug 1",False
B0CXTBZWQH,"DOOGEE N55 Android 14 Cell Phone,9GB+128GB Expandable 1TB Android Phone,6.56&quot; HD+ 90Hz Unlocked cell Phone,5150mAh Battery,13MP+8MP,Dual SIM 4G Phone,Face Unlock,OTG/T-Mobile",$139.99,,USD,3.9,15,https://www.amazon.com/dp/B0CXTBZWQH,https://m.media-amazon.com/images/I/714nR39QJoL._AC_UY654_FMwebp_QL65_.jpg,1,$139.99,False,False,True,False,50+ bought in past month,"FREE delivery Sun, Aug 4 Or fastest delivery Thu, Aug 1",False
B0CCT15Z1F,Total by Verizon Motorola moto g Stylus (2023) Locked 64GB 5000mAh Battery 50MP Quad Pixel Camera 6.5-in. 90Hz Display Blue,$59.88,,USD,3.5,22,https://www.amazon.com/dp/B0CCT15Z1F,https://m.media-amazon.com/images/I/711NsNK4YeL._AC_UY654_FMwebp_QL65_.jpg,1,$59.88,False,False,True,False,,"FREE delivery Sun, Aug 4 Or fastest delivery Thu, Aug 1",False
B0CMDR2X3M,"SAMSUNG Galaxy S24+ Plus Cell Phone, 256GB AI Smartphone, Unlocked Android, 50MP Camera, Fastest Processor, Long Battery Life, US Version 2024 Cobalt Violet",$999.99,,USD,4.7,73,https://www.amazon.com/dp/B0CMDR2X3M,https://m.media-amazon.com/images/I/71jbE08QOLL._AC_UY654_FMwebp_QL65_.jpg,2,$745.19,False,False,True,True,1K+ bought in past month,"FREE delivery Sun, Aug 4 Or fastest delivery Thu, Aug 1",False
B004OA6X6C,"VTech LS6425-3 DECT 6.0 Expandable Cordless Phone with Answering System and Caller ID/Call Waiting, Silver with 3 Handsets",$67.41,$79.95,USD,4.4,2300,https://www.amazon.com/dp/B004OA6X6C,https://m.media-amazon.com/images/I/71M3vmib3OS._AC_UY654_FMwebp_QL65_.jpg,54,$46.95,False,False,False,False,200+ bought in past month,"FREE delivery Thu, Aug 1",False
B0CZLFDWJZ,"UMIDIGI Unlocked Cell Phone, G5 Android 13 Smartphones, 5000mAh 8+128GB/TF 1TB Expand, Ultra-Slim 6.6&quot; Screen Unlocked Phones, 50MP AI Camera Fingerprint/Face Unlocked 4G Dual SIM Mobile Phones",$139.99,,USD,4,109,https://www.amazon.com/dp/B0CZLFDWJZ,https://m.media-amazon.com/images/I/71wE1X+3s0L._AC_UY654_FMwebp_QL65_.jpg,1,$139.99,False,False,True,False,,"FREE delivery Sun, Aug 4 Or fastest delivery Thu, Aug 1",True
B0CMTLGC9W,"Kids Smart Phone for Girls, Christmas Birthday Gifts for Girls Age 3-10 Kids Toys Cell Phone, 2.8&quot; Touchscreen Toddler Learning Play Toy Phone with Dual Camera, Game, Music Player, 8G SD Card (Purple)",$35.90,$39.99,USD,4.2,1160,https://www.amazon.com/dp/B0CMTLGC9W,https://m.media-amazon.com/images/I/71dwraR96OL._AC_UY654_FMwebp_QL65_.jpg,1,$35.90,True,False,True,False,4K+ bought in past month,"FREE delivery Sun, Aug 4 Or fastest delivery Thu, Aug 1",False
B0B8F1S1XG,"AT&amp;T CL82219 DECT 6.0 2-Handset Cordless Phone for Home with Answering Machine, Call Blocking, Caller ID Announcer, Intercom and Long Range, Black",$60.71,$65.95,USD,4.4,479,https://www.amazon.com/dp/B0B8F1S1XG,https://m.media-amazon.com/images/I/71fPZrfv6aL._AC_UY654_FMwebp_QL65_.jpg,6,$19.20,False,False,True,False,500+ bought in past month,"FREE delivery Sun, Aug 4 Or fastest delivery Thu, Aug 1",False
B0D4SWRPM4,Panasonic KX-TG994 DECT 6.0 Bluetooth 4-Handset Phone Bundle (Renewed),$59.99,$89.97,USD,5,1,https://www.amazon.com/dp/B0D4SWRPM4,https://m.media-amazon.com/images/I/81AxAgS8C+L._AC_UY654_FMwebp_QL65_.jpg,1,$59.99,False,False,False,False,100+ bought in past month,"FREE delivery Aug 2 - 6 Or fastest delivery Tomorrow, Jul 31",False
B0CYQ916ZY,"Google Pixel 8a - Unlocked Android Phone with Google AI, Advanced Pixel Camera and 24-Hour Battery - Obsidian - 128 GB",$449.00,$499.00,USD,4.3,201,https://www.amazon.com/dp/B0CYQ916ZY,https://m.media-amazon.com/images/I/71n1Bn04lJL._AC_UY654_FMwebp_QL65_.jpg,2,$348.80,False,False,True,False,1K+ bought in past month,"FREE delivery Sun, Aug 4 Or fastest delivery Thu, Aug 1",True
B07D2BHBYR,"AT&amp;T CL84107 DECT 6.0 Expandable Corded/Cordless Phone with Smart Call Blocker, Black/Silver with 1 Handset",$73.54,,USD,4.4,5626,https://www.amazon.com/dp/B07D2BHBYR,https://m.media-amazon.com/images/I/71hUFlVKtDL._AC_UY654_FMwebp_QL65_.jpg,2,$29.81,False,False,True,False,200+ bought in past month,"FREE delivery Sun, Aug 4 Or fastest delivery Thu, Aug 1",False
